{
  "schema_version": "1.0.0",
  "asset_id": "track-03",
  "status": "passed",
  "scope": "dummy_technical_only",
  "measurements": {
    "duration_seconds": 451.75,
    "sample_peak_dbfs": -17.03121272674113,
    "rms_dbfs": -25.300625304439492,
    "max_silence_seconds": 0.0025208333333333333,
    "vocal_probability": null,
    "max_similarity": null
  },
  "thresholds_version": "dummy-1.0.0",
  "not_evaluated": [
    "vocal_classifier",
    "spectral_anomaly",
    "audio_similarity"
  ],
  "failures": []
}
